UPC,Title,Brand,Quantity,Price,Condition,Images,Description
889698123456,"Funko Pop Batman Dark Knight","Funko",10,15.99,"New","https://example.com/batman1.jpg,https://example.com/batman2.jpg","Batman Funko Pop from Dark Knight series"
889698789012,"Marvel Spider-Man Figure","Marvel",7,12.99,"New","https://example.com/spiderman.jpg","Amazing Spider-Man collectible figure"
889698345678,"Star Wars Darth Vader Helmet","Star Wars",3,89.99,"New","https://example.com/vader.jpg","Authentic Darth Vader helmet replica"
889698456789,"Pokemon Pikachu Plush","Pokemon",15,9.99,"New","https://example.com/pikachu.jpg","Soft and cuddly Pikachu plush toy"
889698567890,"Harry Potter Wand Replica","Harry Potter",5,25.99,"New","https://example.com/wand.jpg","Official Harry Potter wand replica"